{
  "approved": false,
  "findings": [
    {
      "severity": "high",
      "message": "The chart candidate preserves visible content, but several bars still merge multiple handwritten chord symbols into one raw measure string.",
      "area": "measure fidelity"
    },
    {
      "severity": "medium",
      "message": "The lower final system contains an ambiguous chord token transcribed as 'Fmb'.",
      "area": "ending cadence"
    }
  ],
  "unresolved_items": [
    "Confirm whether the final lower-system second chord is 'Fmb', 'Fm6', or another handwritten symbol.",
    "Confirm the intended beat split for measures encoded as combined strings such as 'AbM7 Gm7' and 'CM7 EM7'."
  ],
  "next_steps": [
    "If available, obtain a flatter or higher-contrast rescan for the last two systems.",
    "Refine the align step after human confirmation before publishing to lead-sheets markdown."
  ]
}
